{
  "name": "Solomining",
  "slug": "solomining",
  "website": "https://solomining.de/",
  "region": "Europe",
  "country": "Germany",
  "description": "Solomining.de – Premium Bitaxe and open-source miners, made in Germany. Active since 2024. Europe’s leading and most trusted Bitaxe manufacturer.",
  "active": true,
  "social": {
    "x": "https://x.com/solo_mining",
    "instagram": "",
    "youtube": ""
  }
}
