{
  "name": "Solo Satoshi",
  "slug": "solo-satoshi",
  "website": "https://www.solosatoshi.com/product-category/bitcoin-miners/bitaxe/",
  "region": "North America",
  "country": "USA",
  "description": "Solo Satoshi is a small business in Houston, TX. Since early 2024, we've offered a wide variety of open-source miners and been a trusted Bitaxe seller. We specialize in home mining gear with a mission to decentralize Bitcoin mining. Same-day shipping to 70+ countries.",
  "active": true,
  "social": {
    "x": "https://x.com/SoloSatoshi",
    "instagram": "https://www.instagram.com/solosatoshi_/",
    "youtube": "https://www.youtube.com/@Solo.Satoshi",
    "tiktok": "https://www.tiktok.com/@solo.satoshi",
    "nostr": "https://primal.net/SoloSatoshi"
  }
}
