{
  "name": "Example Vendor",
  "slug": "example-vendor",
  "website": "https://example-vendor.com",
  "region": "Europe",
  "country": "Italy",
  "description": "Official Bitaxe reseller for Europe \u2014 ships within 2 business days.",
  "active": true,
  "social": {
    "x": "https://x.com/examplevendor",
    "instagram": "https://instagram.com/examplevendor",
    "youtube": "",
    "tiktok": "",
    "nostr": ""
  }
}
